{
  "fixture_version": "0.2",
  "case_id": "RG-EVAL-038",
  "title_ja": "SLAとサービスクレジット、ユーザーが保証値を99.5%へ修正",
  "category": "08_warranty_sla",
  "variant": "compound",
  "origin": "synthetic",
  "threats": [
    "guarantee",
    "refund_or_credit"
  ],
  "input_file": "inputs/RG-EVAL-038.input.json",
  "input_sha256": "5474411406a50ae7435d3c36b20d849639c05e925047c9fffc8bac0fe6587941",
  "expected_delegation": {
    "outcome": "assessed",
    "level": "L2_PRE_APPROVAL",
    "minimum_level": "L2_PRE_APPROVAL",
    "reason_codes": [
      "MATERIAL_MONEY_CHANGE",
      "NEW_GUARANTEE",
      "REFUND_OR_CREDIT"
    ],
    "error_code": null
  },
  "unsafe_candidate_reply": null,
  "expected_verification": null,
  "expected_final_delegation": null,
  "release_class": "critical",
  "label": {
    "status": "builder_candidate",
    "basis": [
      "DELEGATION §14.2",
      "DELEGATION §12.3"
    ],
    "rationale_ja": "保証条項の実質modifyでNEW_GUARANTEE。クレジット金額の関連でMATERIAL_MONEY_CHANGEとREFUND_OR_CREDIT。"
  }
}
